{
  "drivers": [
    {
      "driverId": 1,
      "driverRef": "hamilton",
      "code": "HAM",
      "permanent_number": 44,
      "forename": "Lewis",
      "surname": "Hamilton",
      "nationality": "British",
      "photo": null
    },
    {
      "driverId": 4,
      "driverRef": "alonso",
      "code": "ALO",
      "permanent_number": 14,
      "forename": "Fernando",
      "surname": "Alonso",
      "nationality": "Spanish",
      "photo": null
    },
    {
      "driverId": 807,
      "driverRef": "hulkenberg",
      "code": "HUL",
      "permanent_number": 27,
      "forename": "Nico",
      "surname": "Hülkenberg",
      "nationality": "German",
      "photo": null
    },
    {
      "driverId": 815,
      "driverRef": "perez",
      "code": "PER",
      "permanent_number": 11,
      "forename": "Sergio",
      "surname": "Pérez",
      "nationality": "Mexican",
      "photo": null
    },
    {
      "driverId": 822,
      "driverRef": "bottas",
      "code": "BOT",
      "permanent_number": 77,
      "forename": "Valtteri",
      "surname": "Bottas",
      "nationality": "Finnish",
      "photo": null
    },
    {
      "driverId": 830,
      "driverRef": "max_verstappen",
      "code": "VER",
      "permanent_number": 3,
      "forename": "Max",
      "surname": "Verstappen",
      "nationality": "Dutch",
      "photo": null
    },
    {
      "driverId": 832,
      "driverRef": "sainz",
      "code": "SAI",
      "permanent_number": 55,
      "forename": "Carlos",
      "surname": "Sainz",
      "nationality": "Spanish",
      "photo": null
    },
    {
      "driverId": 839,
      "driverRef": "ocon",
      "code": "OCO",
      "permanent_number": 31,
      "forename": "Esteban",
      "surname": "Ocon",
      "nationality": "French",
      "photo": null
    },
    {
      "driverId": 840,
      "driverRef": "stroll",
      "code": "STR",
      "permanent_number": 18,
      "forename": "Lance",
      "surname": "Stroll",
      "nationality": "Canadian",
      "photo": null
    },
    {
      "driverId": 842,
      "driverRef": "gasly",
      "code": "GAS",
      "permanent_number": 10,
      "forename": "Pierre",
      "surname": "Gasly",
      "nationality": "French",
      "photo": null
    },
    {
      "driverId": 844,
      "driverRef": "leclerc",
      "code": "LEC",
      "permanent_number": 16,
      "forename": "Charles",
      "surname": "Leclerc",
      "nationality": "Monegasque",
      "photo": null
    },
    {
      "driverId": 846,
      "driverRef": "norris",
      "code": "NOR",
      "permanent_number": 1,
      "forename": "Lando",
      "surname": "Norris",
      "nationality": "British",
      "photo": null
    },
    {
      "driverId": 847,
      "driverRef": "russell",
      "code": "RUS",
      "permanent_number": 63,
      "forename": "George",
      "surname": "Russell",
      "nationality": "British",
      "photo": null
    },
    {
      "driverId": 848,
      "driverRef": "albon",
      "code": "ALB",
      "permanent_number": 23,
      "forename": "Alexander",
      "surname": "Albon",
      "nationality": "Thai",
      "photo": null
    },
    {
      "driverId": 852,
      "driverRef": "tsunoda",
      "code": "TSU",
      "permanent_number": 22,
      "forename": "Yuki",
      "surname": "Tsunoda",
      "nationality": "Japanese",
      "photo": null
    },
    {
      "driverId": 857,
      "driverRef": "piastri",
      "code": "PIA",
      "permanent_number": 81,
      "forename": "Oscar",
      "surname": "Piastri",
      "nationality": "Australian",
      "photo": null
    },
    {
      "driverId": 859,
      "driverRef": "lawson",
      "code": "LAW",
      "permanent_number": 30,
      "forename": "Liam",
      "surname": "Lawson",
      "nationality": "New Zealander",
      "photo": null
    },
    {
      "driverId": 860,
      "driverRef": "bearman",
      "code": "BEA",
      "permanent_number": 87,
      "forename": "Oliver",
      "surname": "Bearman",
      "nationality": "British",
      "photo": null
    },
    {
      "driverId": 861,
      "driverRef": "colapinto",
      "code": "COL",
      "permanent_number": 43,
      "forename": "Franco",
      "surname": "Colapinto",
      "nationality": "Argentine",
      "photo": null
    },
    {
      "driverId": 863,
      "driverRef": "antonelli",
      "code": "ANT",
      "permanent_number": 12,
      "forename": "Andrea Kimi",
      "surname": "Antonelli",
      "nationality": "Italian",
      "photo": null
    },
    {
      "driverId": 864,
      "driverRef": "arvid_lindblad",
      "code": "LIN",
      "permanent_number": 41,
      "forename": "Arvid",
      "surname": "Lindblad",
      "nationality": "British",
      "photo": null
    },
    {
      "driverId": 865,
      "driverRef": "bortoleto",
      "code": "BOR",
      "permanent_number": 5,
      "forename": "Gabriel",
      "surname": "Bortoleto",
      "nationality": "Brazilian",
      "photo": null
    },
    {
      "driverId": 866,
      "driverRef": "hadjar",
      "code": "HAD",
      "permanent_number": 6,
      "forename": "Isack",
      "surname": "Hadjar",
      "nationality": "French",
      "photo": null
    }
  ],
  "teams": [
    {
      "team_entity_id": "1-1968",
      "constructorId": 1,
      "constructorRef": "mclaren",
      "name": "McLaren",
      "short_name": "McLaren",
      "season": 2026,
      "colour": "#ff8000",
      "colour_on_light": "#ff8000"
    },
    {
      "team_entity_id": "3-1975",
      "constructorId": 3,
      "constructorRef": "williams",
      "name": "Williams",
      "short_name": "Williams",
      "season": 2026,
      "colour": "#1868db",
      "colour_on_light": "#1868db"
    },
    {
      "team_entity_id": "6-1950",
      "constructorId": 6,
      "constructorRef": "ferrari",
      "name": "Ferrari",
      "short_name": "Ferrari",
      "season": 2026,
      "colour": "#e8002d",
      "colour_on_light": "#e8002d"
    },
    {
      "team_entity_id": "9-2005",
      "constructorId": 9,
      "constructorRef": "red_bull",
      "name": "Red Bull",
      "short_name": "Red Bull",
      "season": 2026,
      "colour": "#3671c6",
      "colour_on_light": "#3671c6"
    },
    {
      "team_entity_id": "117-2021",
      "constructorId": 117,
      "constructorRef": "aston_martin",
      "name": "Aston Martin",
      "short_name": "Aston Martin",
      "season": 2026,
      "colour": "#229971",
      "colour_on_light": "#229971"
    },
    {
      "team_entity_id": "131-2010",
      "constructorId": 131,
      "constructorRef": "mercedes",
      "name": "Mercedes",
      "short_name": "Mercedes",
      "season": 2026,
      "colour": "#00a19c",
      "colour_on_light": "#00a19c"
    },
    {
      "team_entity_id": "210-2016",
      "constructorId": 210,
      "constructorRef": "haas",
      "name": "Haas F1 Team",
      "short_name": "Haas",
      "season": 2026,
      "colour": "#6c757d",
      "colour_on_light": "#6c757d"
    },
    {
      "team_entity_id": "214-2021",
      "constructorId": 214,
      "constructorRef": "alpine",
      "name": "Alpine F1 Team",
      "short_name": "Alpine",
      "season": 2026,
      "colour": "#d4407e",
      "colour_on_light": "#d4407e"
    },
    {
      "team_entity_id": "215-2024",
      "constructorId": 215,
      "constructorRef": "rb",
      "name": "RB F1 Team",
      "short_name": "RB",
      "season": 2026,
      "colour": "#6692ff",
      "colour_on_light": "#6692ff"
    },
    {
      "team_entity_id": "216-2026",
      "constructorId": 216,
      "constructorRef": "audi",
      "name": "Audi",
      "short_name": "Audi",
      "season": 2026,
      "colour": "#00707f",
      "colour_on_light": "#00707f"
    },
    {
      "team_entity_id": "217-2026",
      "constructorId": 217,
      "constructorRef": "cadillac",
      "name": "Cadillac F1 Team",
      "short_name": "Cadillac",
      "season": 2026,
      "colour": "#7a5c3e",
      "colour_on_light": "#7a5c3e"
    }
  ],
  "races": [
    {
      "race_id": 1169,
      "season": 2026,
      "round": 1,
      "name": "Australian Grand Prix",
      "slug": "australian-grand-prix",
      "circuit_id": 1,
      "starts_at": "2026-03-08T04:00:00Z",
      "regs_era": "2026_reset"
    },
    {
      "race_id": 1170,
      "season": 2026,
      "round": 2,
      "name": "Chinese Grand Prix",
      "slug": "chinese-grand-prix",
      "circuit_id": 17,
      "starts_at": "2026-03-15T07:00:00Z",
      "regs_era": "2026_reset"
    },
    {
      "race_id": 1171,
      "season": 2026,
      "round": 3,
      "name": "Japanese Grand Prix",
      "slug": "japanese-grand-prix",
      "circuit_id": 22,
      "starts_at": "2026-03-29T05:00:00Z",
      "regs_era": "2026_reset"
    },
    {
      "race_id": 1172,
      "season": 2026,
      "round": 4,
      "name": "Miami Grand Prix",
      "slug": "miami-grand-prix",
      "circuit_id": 79,
      "starts_at": "2026-05-03T20:00:00Z",
      "regs_era": "2026_reset"
    },
    {
      "race_id": 1173,
      "season": 2026,
      "round": 5,
      "name": "Canadian Grand Prix",
      "slug": "canadian-grand-prix",
      "circuit_id": 7,
      "starts_at": "2026-05-24T20:00:00Z",
      "regs_era": "2026_reset"
    },
    {
      "race_id": 1174,
      "season": 2026,
      "round": 6,
      "name": "Monaco Grand Prix",
      "slug": "monaco-grand-prix",
      "circuit_id": 6,
      "starts_at": "2026-06-07T13:00:00Z",
      "regs_era": "2026_reset"
    },
    {
      "race_id": 1175,
      "season": 2026,
      "round": 7,
      "name": "Barcelona Grand Prix",
      "slug": "barcelona-grand-prix",
      "circuit_id": 4,
      "starts_at": "2026-06-14T13:00:00Z",
      "regs_era": "2026_reset"
    },
    {
      "race_id": 1176,
      "season": 2026,
      "round": 8,
      "name": "Austrian Grand Prix",
      "slug": "austrian-grand-prix",
      "circuit_id": 70,
      "starts_at": "2026-06-28T13:00:00Z",
      "regs_era": "2026_reset"
    },
    {